{
  "$schema": "component-recipes.schema.json",
  "id": "shruggie-component-recipes",
  "kind": "component-recipe-catalog",
  "version": "1.0.0",
  "interface_canon_compatibility": ["1.0.0"],
  "grammar": {
    "expresses": ["bounded-component-recipes"],
    "forbids": ["application-screens", "product-navigation", "route-trees", "renderer-property-bags", "raw-visual-values", "free-form-nesting"]
  },
  "required_dimensions": ["purpose", "element", "variants", "densities", "states", "roles", "keyboard", "target", "icons", "accessibility", "motion", "responsive", "overrides", "owner", "verification"],
  "components": {
    "AppFrame": {
      "purpose": "Own application-level environment boundaries and the root content frame.",
      "element": "application-shell",
      "variants": ["default"],
      "densities": ["comfortable", "compact"],
      "states": ["default", "focus-visible"],
      "roles": {"background": "$role.surface.background", "foreground": "$role.text.primary", "gutter_compact": "$role.layout.gutter.compact", "gutter_expanded": "$role.layout.gutter.expanded"},
      "keyboard": ["Tab follows document order within the global focus boundary", "Skip link moves focus to main content"],
      "target": {"interactive": false, "minimum": 0},
      "icons": {"policy": "optional", "accessible_name": "inherited-from-control"},
      "accessibility": {"role": "application-landmarks", "name": "landmarks", "focus": "global-boundary", "relationships": ["header-main-overlay"]},
      "motion": {"standard": "$role.motion.standard", "reduced": "$role.motion.reduced"},
      "responsive": {"inputs": ["viewport", "safe_area", "window_class", "text_scale", "ime_obstruction", "titlebar_regions"], "compact": "single-column", "expanded": "bounded-content"},
      "overrides": ["roles.background"],
      "owner": "app-frame",
      "verification": ["app-frame-single-owner", "app-frame-focus-boundary", "app-frame-ime-reachability"]
    },
    "Button": {
      "purpose": "Trigger one named action.",
      "element": "button",
      "variants": ["primary", "secondary", "ghost", "destructive"],
      "densities": ["comfortable", "compact"],
      "states": ["default", "hover", "pressed", "focus-visible", "disabled", "loading"],
      "roles": {"fill": "$role.action.primary", "foreground": "$role.text.on_action", "focus": "$role.focus.ring", "destructive": "$role.action.destructive"},
      "keyboard": ["Enter activates", "Space activates"],
      "target": {"interactive": true, "minimum": 44},
      "icons": {"policy": "optional", "accessible_name": "visible-label"},
      "accessibility": {"role": "button", "name": "required-visible-or-aria", "focus": "self", "relationships": []},
      "motion": {"standard": "$role.motion.fast", "reduced": "$role.motion.reduced"},
      "responsive": {"inputs": ["pointer_precision", "hover", "text_scale"], "compact": "wrap-label", "expanded": "intrinsic"},
      "overrides": ["roles.fill"],
      "owner": "server",
      "verification": ["button-keyboard", "button-loading-name", "control-target"]
    },
    "IconButton": {
      "purpose": "Trigger one named action represented visually by an icon.",
      "element": "button",
      "variants": ["primary", "secondary", "ghost", "destructive"],
      "densities": ["comfortable", "compact"],
      "states": ["default", "hover", "pressed", "focus-visible", "disabled", "loading"],
      "roles": {"fill": "$role.action.primary", "foreground": "$role.text.on_action", "focus": "$role.focus.ring"},
      "keyboard": ["Enter activates", "Space activates"],
      "target": {"interactive": true, "minimum": 44},
      "icons": {"policy": "required", "accessible_name": "required-on-control"},
      "accessibility": {"role": "button", "name": "required", "focus": "self", "relationships": []},
      "motion": {"standard": "$role.motion.fast", "reduced": "$role.motion.reduced"},
      "responsive": {"inputs": ["pointer_precision", "hover"], "compact": "minimum-target", "expanded": "minimum-target"},
      "overrides": ["roles.fill"],
      "owner": "server",
      "verification": ["icon-button-name", "icon-decorative", "control-target"]
    },
    "Toolbar": {
      "purpose": "Group a bounded set of related controls with roving focus.",
      "element": "toolbar",
      "variants": ["horizontal", "vertical"],
      "densities": ["comfortable", "compact"],
      "states": ["default", "hover", "pressed", "focus-visible", "disabled", "selected"],
      "roles": {"surface": "$role.surface.card", "foreground": "$role.text.primary", "border": "$role.border.default", "focus": "$role.focus.ring"},
      "keyboard": ["Arrow keys move between enabled controls", "Home moves to first control", "End moves to last control"],
      "target": {"interactive": true, "minimum": 44},
      "icons": {"policy": "optional", "accessible_name": "per-control"},
      "accessibility": {"role": "toolbar", "name": "required", "focus": "roving", "relationships": []},
      "motion": {"standard": "$role.motion.fast", "reduced": "$role.motion.reduced"},
      "responsive": {"inputs": ["window_class", "pointer_precision", "hover"], "compact": "overflow-scroll", "expanded": "intrinsic"},
      "overrides": ["roles.surface"],
      "owner": "client",
      "verification": ["toolbar-roving-focus", "toolbar-orientation", "control-target"]
    },
    "Tabs": {
      "purpose": "Switch among a bounded set of peer panels.",
      "element": "tablist",
      "variants": ["automatic", "manual"],
      "densities": ["comfortable", "compact"],
      "states": ["default", "hover", "pressed", "focus-visible", "disabled", "selected"],
      "roles": {"foreground": "$role.text.primary", "muted": "$role.text.muted", "selected": "$role.action.primary", "focus": "$role.focus.ring"},
      "keyboard": ["Arrow keys move between tabs", "Home selects first tab", "End selects last tab", "Enter or Space activates in manual mode"],
      "target": {"interactive": true, "minimum": 44},
      "icons": {"policy": "optional", "accessible_name": "visible-label"},
      "accessibility": {"role": "tabs", "name": "tablist-required", "focus": "roving", "relationships": ["tab-controls-panel", "panel-labelledby-tab"]},
      "motion": {"standard": "$role.motion.fast", "reduced": "$role.motion.reduced"},
      "responsive": {"inputs": ["window_class", "pointer_precision", "hover"], "compact": "horizontal-scroll", "expanded": "intrinsic"},
      "overrides": ["roles.selected"],
      "owner": "client",
      "verification": ["tabs-keyboard", "tabs-relationships", "tabs-selected-focus"]
    },
    "Menu": {
      "purpose": "Expose a temporary list of named actions.",
      "element": "menu",
      "variants": ["dropdown"],
      "densities": ["comfortable", "compact"],
      "states": ["default", "hover", "pressed", "focus-visible", "disabled", "selected"],
      "roles": {"surface": "$role.surface.overlay", "foreground": "$role.text.primary", "muted": "$role.text.muted", "focus": "$role.focus.ring"},
      "keyboard": ["Arrow keys move through items", "Home and End move to boundaries", "Typeahead moves to matching item", "Escape closes and returns focus"],
      "target": {"interactive": true, "minimum": 44},
      "icons": {"policy": "optional", "accessible_name": "item-label"},
      "accessibility": {"role": "menu", "name": "trigger-required", "focus": "contained-roving", "relationships": ["trigger-controls-menu"]},
      "motion": {"standard": "$role.motion.fast", "reduced": "$role.motion.reduced"},
      "responsive": {"inputs": ["viewport", "pointer_precision", "touch", "ime_obstruction"], "compact": "viewport-contained", "expanded": "anchor-contained"},
      "overrides": ["roles.surface"],
      "owner": "client",
      "verification": ["menu-keyboard", "menu-typeahead", "menu-focus-return"]
    },
    "Dialog": {
      "purpose": "Present a modal task with explicit title and dismissal.",
      "element": "dialog",
      "variants": ["modal", "alert"],
      "densities": ["comfortable", "compact"],
      "states": ["default", "focus-visible", "loading", "invalid", "warning", "success"],
      "roles": {"surface": "$role.surface.overlay", "foreground": "$role.text.primary", "muted": "$role.text.muted", "focus": "$role.focus.ring"},
      "keyboard": ["Tab remains within the dialog", "Escape dismisses when allowed", "Close returns focus to trigger"],
      "target": {"interactive": true, "minimum": 44},
      "icons": {"policy": "optional", "accessible_name": "close-control-required"},
      "accessibility": {"role": "dialog", "name": "title-required", "focus": "trapped-and-returned", "relationships": ["dialog-labelledby-title", "dialog-describedby-description"]},
      "motion": {"standard": "$role.motion.standard", "reduced": "$role.motion.reduced"},
      "responsive": {"inputs": ["viewport", "window_class", "text_scale", "ime_obstruction"], "compact": "edge-contained", "expanded": "centered"},
      "overrides": ["roles.surface"],
      "owner": "client",
      "verification": ["dialog-focus-trap", "dialog-name", "dialog-focus-return"]
    },
    "Field": {
      "purpose": "Associate a visible label, description, validation message, and control.",
      "element": "field-group",
      "variants": ["stacked", "inline"],
      "densities": ["comfortable", "compact"],
      "states": ["default", "focus-visible", "disabled", "invalid", "warning", "success"],
      "roles": {"foreground": "$role.text.primary", "muted": "$role.text.muted", "invalid": "$role.action.destructive", "focus": "$role.focus.ring"},
      "keyboard": ["Label activation focuses the associated control"],
      "target": {"interactive": false, "minimum": 0},
      "icons": {"policy": "optional", "accessible_name": "status-text-required"},
      "accessibility": {"role": "group", "name": "visible-label-required", "focus": "delegated-to-control", "relationships": ["label-for-control", "control-describedby-message"]},